{
  "schema": "lrc-avg/recipe/1",
  "session_id": "6180874a-c0f8-4277-a34b-d7574f77bd8b",
  "created": "2026-10-01T12:15:47.188Z",
  "intent_id": "landscape_golden_hour",
  "source": {
    "uuid": "CF12AF60-0858-4181-9562-376D16B89126",
    "filename": "20260907-_OZ80099.NEF"
  },
  "process_version": "15.4",
  "settings": {
    "exposure": 0.63,
    "contrast": 0,
    "highlights": -41,
    "shadows": 80,
    "whites": 0,
    "blacks": 60,
    "texture": 16,
    "clarity": 14,
    "dehaze": 6,
    "vibrance": 23,
    "saturation": 0,
    "temperature": 6700,
    "tint": 15,
    "grading.shadows.hue": 0,
    "grading.shadows.sat": 0,
    "grading.shadows.lum": 0,
    "grading.midtones.hue": 0,
    "grading.midtones.sat": 0,
    "grading.midtones.lum": 0,
    "grading.highlights.hue": 0,
    "grading.highlights.sat": 0,
    "grading.highlights.lum": 0,
    "grading.global.hue": 0,
    "grading.global.sat": 0,
    "grading.global.lum": 0,
    "grading.blending": 50,
    "grading.balance": 0,
    "sharpening.amount": 24,
    "sharpening.radius": 2,
    "sharpening.detail": 25,
    "sharpening.masking": 0,
    "noise.luminance": 48,
    "noise.color": 25,
    "lens.corrections_enable": true,
    "lens.profile_enable": 1,
    "lens.ca_remove": 1,
    "tone_curve.master": [
      0,
      0,
      255,
      255
    ],
    "tone_curve.red": [
      0,
      0,
      255,
      255
    ],
    "tone_curve.green": [
      0,
      0,
      255,
      255
    ],
    "tone_curve.blue": [
      0,
      0,
      255,
      255
    ],
    "hsl.red.hue": 0,
    "hsl.red.sat": 0,
    "hsl.red.lum": 0,
    "hsl.orange.hue": 0,
    "hsl.orange.sat": 0,
    "hsl.orange.lum": 0,
    "hsl.yellow.hue": 10,
    "hsl.yellow.sat": 0,
    "hsl.yellow.lum": 0,
    "hsl.green.hue": 6,
    "hsl.green.sat": 8,
    "hsl.green.lum": 0,
    "hsl.aqua.hue": 0,
    "hsl.aqua.sat": 0,
    "hsl.aqua.lum": 0,
    "hsl.blue.hue": 0,
    "hsl.blue.sat": 0,
    "hsl.blue.lum": 0,
    "hsl.purple.hue": 0,
    "hsl.purple.sat": 0,
    "hsl.purple.lum": 0,
    "hsl.magenta.hue": 0,
    "hsl.magenta.sat": 0,
    "hsl.magenta.lum": 0,
    "camera_profile": "Adobe Landscape"
  }
}
